{
  "@context": "https://schema.org",
  "@type": "Event",
  "name": "Sample Workshop",
  "url": "https://www.alanranger.com/sample",
  "image": "https://www.alanranger.com/sample.jpg",
  "description": "Sample event for validation test.",
  "startDate": "2025-12-01T09:00:00+00:00",
  "endDate": "2025-12-01T17:00:00+00:00",
  "organizer": {
    "@type": "Organization",
    "name": "Alan Ranger Photography",
    "url": "https://www.alanranger.com/",
    "logo": "https://images.squarespace-cdn.com/content/v1/5013f4b2c4aaa4752ac69b17/b859ad2b-1442-4595-b9a4-410c32299bf8/ALAN+RANGER+photography+LOGO+BLACK.+switched+small.png?format=1500w",
    "address": "45 Hathaway Road, Tile Hill Village, Coventry, CV4 9HW"
  },
  "location": {
    "@type": "Place",
    "name": "Coventry Studio",
    "address": "45 Hathaway Road, Tile Hill Village, Coventry, CV4 9HW"
  },
  "offers": {
    "@type": "Offer",
    "price": "20",
    "priceCurrency": "GBP",
    "availability": "https://schema.org/InStock",
    "url": "https://www.alanranger.com/sample",
    "validFrom": "2025-12-01T09:00:00+00:00"
  }
}
